{"acceptance_oracles":[{"description":"The exact blueprint base passes its own deterministic blueprint validator in the protected sandbox","evidence_type":"test","id":"ORACLE-INITIAL-LKG-ROLLBACK","mandatory":true}],"affected_surfaces":[{"path":"scripts/validate_blueprint.py","reason":"Rollback acceptance oracle"},{"path":"docs/","reason":"Blueprint authority reconstructed at the base commit"}],"assumptions":["The pinned sandbox image remains retrievable"],"authoritative_sources":[{"kind":"requirement","path":"docs/specification.md","sha256":"sha256:25b2d6760c3dbec4e838bf5c6db4dc10cbc3a48d23818aa759da4eb9c6c74776"},{"kind":"requirement","path":"docs/requirements.md","sha256":"sha256:fbd802728839aaede5d3e1d9e6b7bc80daae2162875345438ab36628e47dc17b"},{"kind":"code","path":"scripts/validate_blueprint.py","sha256":"sha256:61a5fc12cf1197312efc7d80a3e7d0a16cec6f4730bb71fd3b6ee13fcb9b2fc6"}],"base_commit":"a0a0b01a19e87f2591c7e97e892cd040ce9c6e58","facts":["The rollback target is the immutable pre-implementation blueprint commit","This rehearsal is evidence for the one authenticated initial-LKG bootstrap only","The rehearsal evaluates an unchanged base-equals-head source and does not propose a candidate mutation"],"governance_change_requested":false,"hypotheses":["The blueprint validator still passes at the exact rollback target"],"non_goals":["Treat the blueprint as a previously deployed executable LKG","Modify the rollback checkout or any protected authority input"],"profile":"code","rapid_review":{"minimum_charters":0,"required":false,"skip_rationale":"The base-equals-head rollback source contains no candidate change; this lane only re-executes its deterministic blueprint oracle with exact source, task, sandbox, provenance, and raw-stream bindings."},"repository_id":"repo:timaday/codex-governed-change","required_gate_ids":["blueprint-quality"],"risk_profile":"low","risks":[{"description":"A different checkout or command is presented as the rollback rehearsal","id":"RISK-ROLLBACK-SOURCE-SUBSTITUTION","impact":"critical","mitigation":"Bind the exact base candidate identity, policy, task, gate definition, raw streams, sandbox capability, and provenance"}],"schema_version":"1.0.0","scope":["Reconstruct the pre-implementation blueprint at the exact base commit","Run its deterministic blueprint validator in the protected disposable sandbox"],"specialist_reviews":["engineering","security","operations"],"task_id":"V0.1.0-INITIAL-LKG-ROLLBACK","unknowns":[]}